<?xml version="1.0" encoding="UTF-8" ?>
<pc:postCards xmlns:xsi="http://www.w3.org/2001/XMLSchema-instance"
             xmlns:pc="http://www.example.com/assylkhan"
             xsi:schemaLocation="http://www.example.com/assylkhan PostCard.xsd">
<postCard>
    <id>1</id>
    <theme>NATURE</theme>
    <cardType>ADVERTISING</cardType>
    <country>Germany</country>
    <year>2014</year>
    <valuable>COLLECTION</valuable>
</postCard>

<postCard>
    <id>2</id>
    <theme>CITY_SCENERY</theme>
    <cardType>CONGRATULATORY</cardType>
    <country>USA</country>
    <year>2015</year>
    <author>EPAM</author>
    <valuable>HISTORICAL</valuable>
</postCard>

<postCard>
    <id>3</id>
    <theme>ARCHITECTURE</theme>
    <cardType>ORDINARY</cardType>
    <country>Japan</country>
    <year>2017</year>
    <author>Jamato</author>
    <valuable>THEMATIC</valuable>
</postCard>
             
</pc:postCards>